menu,Description,q
Spiced Pumpkin Phyllo Pie ,เมนูของหวาน เมนู Spiced Pumpkin Phyllo Pie มีวัตถุดิบ ฟักทอง อบเชย ขิง ลูกจันทน์เทศ วานิลลา,อยากกินพายที่ไส้มีรสชาติเครื่องเทศ
Mini Halloween Pumpkin Cupcakes ,เมนูของหวาน เมนู Mini Halloween Pumpkin Cupcakes มีวัตถุดิบ ฟักทอง วานิลลา ขิง ส้ม,อยากกินเค้กรสฟักทองที่ตกแต่งด้วยสีส้มๆ และทำให้นึกถึงเทศกาลฮัลโลวีน
Funny Bones ,เมนูของหวาน เมนู Funny Bones มีวัตถุดิบ ช็อกโกแลต เพรทเซิล,ฉันอยากกินขนมที่รสช็อกโกแลตและมีส่วนประกอบของของหวานกรอบๆ
Glowing Jack-o'-Lantern Cookies ,เมนูของหวาน เมนู Glowing Jack-o'-Lantern Cookies มีวัตถุดิบ มะนาว ส้ม,อยากกินคุกกี้รสส้มที่ตกแต่งด้วยมะนาวและสีเขียวๆ
Monster Eyeballs ,เมนูของหวาน เมนู Monster Eyeballs มีวัตถุดิบ ถั่วลิสง วานิลลา ช็อกโกแลต,ฉันอยากกินขนมที่เป็นลูกตาที่ทำจากถั่วลิสงเคลือบช็อกโกแลต
Blueberry Flaxseed Upside-Down Cakes ,เมนูของหวาน เมนู Blueberry Flaxseed Upside-Down Cakes มีวัตถุดิบ บลูเบอร์รี,อยากกินเค้กรสบลูเบอร์รี่ที่มีอะไรบางอย่างเป็นเครื่องตกแต่ง
Lemon Verbena and Summer Fruit Gelée ,เมนูของหวาน เมนู Lemon Verbena and Summer Fruit Gelée มีวัตถุดิบ มะนาว พีช,ฉันอยากกินของหวานเนื้อเจลลี่ที่มีผลไม้และรสชาติเปรี้ยวๆ
Pear Butterscotch Pie ,เมนูของหวาน เมนู Pear Butterscotch Pie มีวัตถุดิบ อบเชย ลูกจันทน์ แพร์ มะนาว วานิลลา,ฉันอยากกินพายที่ทำจากผลไม้รสเปรี้ยวนิดๆ และมีกลิ่นเครื่องเทศหอมๆ
Berries and Buttermilk Puddings ,เมนูของหวาน เมนู Berries and Buttermilk Puddings มีวัตถุดิบ วานิลลา เลมอน ส้ม ใบกระวาน สตรอเบอร์รี,อยากกินขนมที่รสชาติหวานและมีกลิ่นหอมของผลไม้
Poppy Seed Pound Cake with Plum Pluot Compote ,เมนูของหวาน เมนู Poppy Seed Pound Cake with Plum Pluot Compote มีวัตถุดิบ วานิลลา พลัม เลมอน ลูกจันทน์เทศ,อยากกินขนมปอนด์เค้กที่ผสมผลไม้และมีรสหวานของส้ม
Curry Coriander Shorties ,เมนูของหวาน เมนู Curry Coriander Shorties มีวัตถุดิบ กะหรี่ วานิลลา,อยากกินขนมหวานที่มีรสเผ็ดและกลิ่นหอมของเครื่องเทศ
Chocolate Chip Zucchini Cupcakes ,เมนูของหวาน เมนู Chocolate Chip Zucchini Cupcakes มีวัตถุดิบ โกโก้ อบเชย วานิลลา ซูกินี ช็อกโกแลต,อยากกินขนมเค้กที่มีรสชาติเข้มข้นของช็อกโกแลตและกลิ่นหอมของวานิลลา
Cantaloupe and Cream Sherry Granita ,เมนูของหวาน เมนู Cantaloupe and Cream Sherry Granita มีวัตถุดิบ เลมอน,อยากกินขนมเย็นๆ ที่มีรสเปรี้ยวและกลิ่นหอมของเลมอน
Nectarine Golden Cake ,เมนูของหวาน เมนู Nectarine Golden Cake มีวัตถุดิบ วานิลลา อัลมอนด์ ลูกจันทน์เทศ,อยากกินขนมเค้กที่หอมกลิ่นเครื่องเทศและถั่ว
Quince Poached in Cardamom Syrup ,เมนูของหวาน เมนู Quince Poached in Cardamom Syrup มีวัตถุดิบ เลมอน ส้ม ลูกกระวาน,อยากกินขนมที่รสหวานและมีกลิ่นหอมของเครื่องเทศ
Swedish Lucia Breads ,เมนูของหวาน เมนู Swedish Lucia Breads มีวัตถุดิบ หญ้าฝรั่น ลูกเกด,อยากกินขนมปังที่หอมกลิ่นเครื่องเทศและมีรสหวานจากผลไม้
Phoenician Honey Cookies (Biscuits) ,เมนูของหวาน เมนู Phoenician Honey Cookies (Biscuits) มีวัตถุดิบ มะนาว วานิลลา วอลนัท น้ำผึ้ง,อยากกินขนมหวานที่มีรสชาติเปรี้ยว-หวาน-มัน
Buttermilk Cake with Lemon-and Thyme-Glazed Pear Compote and Greek Yogurt Ice Cream ,เมนูของหวาน เมนู Buttermilk Cake with Lemon-and Thyme-Glazed Pear Compote and Greek Yogurt Ice Cream มีวัตถุดิบ มะนาว ไทม์ ลูกแพร์ วานิลลา,อยากกินเค้กที่มีกลิ่นหอมๆ และมีผลไม้เนื้อนุ่ม
Asian Pear and Grapefruit Salad with Sake Granita and Pear Sorbet ,เมนูของหวาน เมนู Asian Pear and Grapefruit Salad with Sake Granita and Pear Sorbet มีวัตถุดิบ ลูกแพร์ ยี่หร่า,อยากกินของหวานที่มีรสเปรี้ยวและหวาน และมีรสชาติที่สดชื่น
Trail Mix Freezer Cookies ,เมนูของหวาน เมนู Trail Mix Freezer Cookies มีวัตถุดิบ อบเชย วานิลลา ข้าวโอ๊ต มะพร้าว,อยากกินคุกกี้ที่มีรสหวานกำลังดีและเนื้อสัมผัสนุ่มกรุบ
Blueberry Basil Granita ,เมนูของหวาน เมนู Blueberry Basil Granita มีวัตถุดิบ บลูเบอร์รี โหระพา มะนาว น้ำผึ้ง,อยากกินของหวานที่เย็นสดชื่นและมีกลิ่นหอมๆของผลไม้และสมุนไพร
Berry Parfait ,เมนูของหวาน เมนู Berry Parfait มีวัตถุดิบ เลมอนเกรแฮม,อยากกินของหวานที่มีรสชาติเปรี้ยวและหวาน และมีเนื้อสัมผัสที่นุ่ม
Revani ,เมนูของหวาน เมนู Revani มีวัตถุดิบ มะนาว,อยากกินของหวานที่มีรสหวานและมีเนื้อสัมผัสนุ่ม
Pumpkin Hazelnut Compote ,เมนูของหวาน เมนู Pumpkin Hazelnut Compote มีวัตถุดิบ ฟักทองเฮเซลนัท,อยากทานของหวานที่มีส่วนผสมของฟักทองและถั่ว
Helva ,เมนูของหวาน เมนู Helva มีวัตถุดิบ อบเชย,อยากทานของหวานที่หอมกลิ่นเครื่องเทศอบเชย
Vegan Chocolate Mix ,เมนูของหวาน เมนู Vegan Chocolate Mix มีวัตถุดิบ มะพร้าววานิลลา,อยากทานของหวานแบบวีแกนที่หอมกลิ่นมะพร้าว
Plum Kuchen ,เมนูของหวาน เมนู Plum Kuchen มีวัตถุดิบ เลมอนวานิลลาพลัม,อยากทานของหวานที่มีรสเปรี้ยวของเลมอน
Blueberry Muffins with Lemon Blackberry Glaze ,เมนูของหวาน เมนู Blueberry Muffins with Lemon Blackberry Glaze มีวัตถุดิบ อัลมอนด์วานิล لامะพร้าวบลูเบอร์รี่แคชชูแบล็กเบอร์รี่เลมอน,อยากทานของหวานที่หอมกลิ่นบลูเบอร์รี่
Beet Bundt Cake ,เมนูของหวาน เมนู Beet Bundt Cake มีวัตถุดิบ ช็อกโกแลต วานิลลา,อยากกินของหวานที่มีรสชาติช็อกโกแลตและวานิลลา
Lavender Chocolate Bars ,เมนูของหวาน เมนู Lavender Chocolate Bars มีวัตถุดิบ มะพร้าว ลาเวนเดอร์ อัลมอนด์ ลูกเกด,อยากกินของหวานที่มีรสชาติลาเวนเดอร์และอัลมอนด์
Chocolate-Coconut Truffles ,เมนูของหวาน เมนู Chocolate-Coconut Truffles มีวัตถุดิบ มะพร้าว วานิลลา โกโก้,อยากกินของหวานที่มีรสชาติมะพร้าวและโกโก้
Oat Crisps with Blueberries and Crème Fraîche ,เมนูของหวาน เมนู Oat Crisps with Blueberries and Crème Fraîche มีวัตถุดิบ ข้าวโอ๊ต บลูเบอร์รี่,อยากกินของหวานที่มีรสชาติผลไม้และบลูเบอร์รี่
Chocolate-Peanut Butter Terrine with Sugared Peanuts ,เมนูของหวาน เมนู Chocolate-Peanut Butter Terrine with Sugared Peanuts มีวัตถุดิบ ช็อกโกแลต ถั่ว,อยากกินของหวานที่มีรสชาติช็อกโกแลตและถั่ว
Rice Pudding ,เมนูของหวาน เมนู Rice Pudding มีวัตถุดิบ กระวาน วานิลลา,อยากกินของหวานที่มีรสชาติกระวานและวานิลลา
Peach and Pecan Upside-Down Cake ,เมนูของหวาน เมนู Peach and Pecan Upside-Down Cake มีวัตถุดิบ เปคาน พีช ลูกจันทน์เทศ อบเชย วานิลลา,อยากกินของหวานที่มีรสชาติพีชและเปคาน
Roasted Peaches with Amaretti Crumble ,เมนูของหวาน เมนู Roasted Peaches with Amaretti Crumble มีวัตถุดิบ อัลมอนด์ พีช วานิลลา,อยากกินของหวานที่มีรสชาติอัลมอนด์และพีช
Charentais Granita With Chantilly Cream ,เมนูของหวาน เมนู Charentais Granita With Chantilly Cream มีวัตถุดิบ ส้ม มิ้นต์,อยากกินของหวานที่มีรสชาติส้มและมินต์
Peach and Pistachio Praline Semifreddo ,เมนูของหวาน เมนู Peach and Pistachio Praline Semifreddo มีวัตถุดิบ เฮเซลนัท พีช,อยากกินของหวานที่ทำจากพีชและถั่วรสชาติหวานเย็นๆ
Honey Yogurt ,เมนูของหวาน เมนู Honey Yogurt มีวัตถุดิบ น้ำผึ้ง,อยากกินของหวานที่มีรสชาติหวานๆ กินแล้วสดชื่น
Top-Crust Peach and Cardamom Pie ,เมนูของหวาน เมนู Top-Crust Peach and Cardamom Pie มีวัตถุดิบ พีช มะนาว กระวาน น้ำผึ้ง,อยากกินขนมอบตักแบ่งที่มีส่วนผสมผลไม้ เปรี้ยวๆ หวานๆ
Gingered-Peach Pavlovas ,เมนูของหวาน เมนู Gingered-Peach Pavlovas มีวัตถุดิบ วานิลลา มะนาว ขิง พีช ราสเบอร์รี่ แบล็กเบอร์รี่,อยากกินของหวานที่กินแล้วสดชื่น มีรสเปรี้ยวและหวาน มีผลไม้เนื้อสัมผัสกรุบๆ
Lemon-Nut Torte with Summer Berries ,เมนูของหวาน เมนู Lemon-Nut Torte with Summer Berries มีวัตถุดิบ อัลมอนด์ มะนาว ส้ม น้ำผึ้ง วานิลลา สตรอเบอร์รี่,อยากกินของหวานเนื้อสัมผัสนุ่มๆ มีรสเปรี้ยวกลมกล่อม หวานกำลังดี และมีผลไม้รสเปรี้ยวตัดรส
Three-Layer Berry and Brown Sugar Pavlova ,เมนูของหวาน เมนู Three-Layer Berry and Brown Sugar Pavlova มีวัตถุดิบ วานิลลา สตรอเบอร์รี่ แบล็กเบอร์รี่,อยากกินของหวานเนื้อสัมผัสนุ่มๆ มีรสเปรี้ยวหวานกำลังดี มีผลไม้ให้ได้เคี้ยว
Maple Blueberry Parfait ,เมนูของหวาน เมนู Maple Blueberry Parfait มีวัตถุดิบ บลูเบอร์รี่ เมเปิ้ล มะนาว ขิง,อยากกินของหวานที่กินแล้วรู้สึกสดชื่น มีรสหวานอมเปรี้ยว มีส่วนผสมของผลไม้และคาราเมล
Fruit-on-the-Bottom Tapioca Pudding ,เมนูของหวาน เมนู Fruit-on-the-Bottom Tapioca Pudding มีวัตถุดิบ เมล็ดฟินเนล สตรอว์เบอร์รี,อยากทานของหวานที่รสชาติแบบวินเทจที่มีฟรุตสลัด
Melon Slush ,เมนูของหวาน เมนู Melon Slush มีวัตถุดิบ ส้ม,อยากทานของหวานที่รสชาติสดชื่นแบบผลไม้
Raspberry Jell-O Parfaits ,เมนูของหวาน เมนู Raspberry Jell-O Parfaits มีวัตถุดิบ ราสป์เบอร์รี บลูเบอร์รี,อยากทานของหวานที่มีเบอร์รี
Goldies ,เมนูของหวาน เมนู Goldies มีวัตถุดิบ โกโก้ ช็อกโกแลต วานิลลา,อยากทานของหวานช็อกโกแลต
Chocolate Chip Cookies/Cookie Sandwiches ,เมนูของหวาน เมนู Chocolate Chip Cookies/Cookie Sandwiches มีวัตถุดิบ มะพร้าว ช็อกโกแลต วานิลลา,อยากทานคุกกี้ช็อกโกแลตชิป
Vanilla Cupcakes ,เมนูของหวาน เมนู Vanilla Cupcakes มีวัตถุดิบ กะทิ วานิลลา มะนาว,ขออาหารหวานที่รสชาติละมุน มีกลิ่นหอมหวานจากกะทิและวานิลลา และมีเนื้อสัมผัสที่นุ่มฟู
Chocolate Chip and Peanut Blondies ,เมนูของหวาน เมนู Chocolate Chip and Peanut Blondies มีวัตถุดิบ วานิลลา ถั่วลิสง ช็อกโกแลต,ขอขนมที่มีความหวานจากช็อกโกแลตและถั่วลิสง พร้อมเนื้อสัมผัสที่แน่นหนึบ
Blueberry Crumb Bars ,เมนูของหวาน เมนู Blueberry Crumb Bars มีวัตถุดิบ ข้าวโอ๊ต อบเชย อัลมอนด์ บลูเบอร์รี มะนาว,ขออาหารหวานที่มีความกรุบกรอบจากข้าวโอ๊ต ผสานกับกลิ่นหอมหวานจากอบเชยและบลูเบอร์รี
Apricot and Amaretti Crostata ,เมนูของหวาน เมนู Apricot and Amaretti Crostata มีวัตถุดิบ แอปริคอต น้ำผึ้ง อบเชย,อยากได้ขนมที่มีรสชาติหวานอมเปรี้ยวจากแอปริคอต ตัดกับกลิ่นหอมอบอุ่นจากน้ำผึ้งและอบเชย
Pluot Pinwheel Tart ,เมนูของหวาน เมนู Pluot Pinwheel Tart มีวัตถุดิบ อัลมอนด์,อยากได้ขนมที่มีความหอมหวานจากอัลมอนด์ ตัดกับความหวานละมุนจากแป้ง
No-Bake Chocolate Raspberry Cream Pie ,เมนูของหวาน เมนู No-Bake Chocolate Raspberry Cream Pie มีวัตถุดิบ ช็อกโกแลต เลมอน ราสเบอรี,อยากกินของหวานที่ผสมผลไม้เปรี้ยวและหวาน
"Grilled Pineapple with Brown Sugar, Coconut, and Rum ","เมนูของหวาน เมนู Grilled Pineapple with Brown Sugar, Coconut, and Rum มีวัตถุดิบ มะพร้าว สับปะรด รัม แกง มะนาว วานิลลา",อยากกินของหวานที่ใช้ผลไม้รสเปรี้ยวและหวานพร้อมกับความกรอบ
Raspberry Buttermilk Cake ,เมนูของหวาน เมนู Raspberry Buttermilk Cake มีวัตถุดิบ วานิลลา ราสเบอรี,อยากกินของหวานที่มีรสหวานและเปรี้ยว
Yogurt Granita ,เมนูของหวาน เมนู Yogurt Granita มีวัตถุดิบ สตรอว์เบอรี เลมอน,อยากกินของหวานรสเปรี้ยวเย็นสดชื่น
Peanutty Energy Bars ,เมนูของหวาน เมนู Peanutty Energy Bars มีวัตถุดิบ ถั่ว ถั่วลูกเกด ข้าวโอ๊ต วานิลลา,อยากกินของหวานที่มีรสหวานและกรุบกรอบ
Molasses Muffins with Flax and Dates ,เมนูของหวาน เมนู Molasses Muffins with Flax and Dates มีวัตถุดิบ อินทผลัม วานิลลา,อยากกินของหวานที่มีรสหวานและเปรี้ยวพร้อมกับความนุ่ม
Oatmeal Cookies ,เมนูของหวาน เมนู Oatmeal Cookies มีวัตถุดิบ อบเชย ข้าวโอ๊ต ลูกเกด วานิลลา,อยากกินของหวานที่มีรสหวานอบอุ่นและกลิ่นหอม
Grilled Pineapple and Bananas with Lemonade Glaze ,เมนูของหวาน เมนู Grilled Pineapple and Bananas with Lemonade Glaze มีวัตถุดิบ กล้วย สับปะรด เลมอน,อยากกินของหวานที่มีรสหวานและเปรี้ยวพร้อมกับความฉ่ำ
Nectarine-Blackberry Crisp ,เมนูของหวาน เมนู Nectarine-Blackberry Crisp มีวัตถุดิบ เลมอน วานิลลา แบล็กเบอร์รี่,เมนูของหวาน อยากกินของหวานที่มีผลไม้ตระกูลเบอร์รี่และรสเปรี้ยว
Brown Butter Raspberry Tart ,เมนูของหวาน เมนู Brown Butter Raspberry Tart มีวัตถุดิบ วานิลลา ราสเบอร์รี่,เมนูของหวาน อยากกินของหวานที่มีผลไม้ตระกูลเบอร์รี่และมีลักษณะกรุบกรอบ
Blueberry Shortcakes with Lemon and Thyme Biscuits ,เมนูของหวาน เมนู Blueberry Shortcakes with Lemon and Thyme Biscuits มีวัตถุดิบ บลูเบอร์รี่ เลมอน ไทม์ วานิลลา,เมนูของหวาน อยากกินของหวานที่มีผลไม้ตระกูลเบอร์รี่และเนื้อครีม
Lime Curd ,เมนูของหวาน เมนู Lime Curd มีวัตถุดิบ มะนาว,เมนูของหวาน อยากกินของหวานที่มีรสเปรี้ยวและเนื้อครีม
"Mixed Berry Pie with Ginger, Orange, and Almond Streusel ","เมนูของหวาน เมนู Mixed Berry Pie with Ginger, Orange, and Almond Streusel มีวัตถุดิบ ขิง ส้ม อัลมอนด์ บลูเบอร์รี่ ราสเบอร์รี่ แบล็กเบอร์รี่ เลมอน",เมนูของหวาน อยากกินของหวานที่มีผลไม้รสหวานและรสเผ็ด
Blueberry Jam Sandwich Cookies ,เมนูของหวาน เมนู Blueberry Jam Sandwich Cookies มีวัตถุดิบ บลูเบอร์รี เลมอน,อยากได้ของหวานที่มีผลไม้รสเปรี้ยวผสมกับรสหวาน
"Fresh Fruit Ice Trio: Lime, Watermelon & Pineapple ","เมนูของหวาน เมนู Fresh Fruit Ice Trio: Lime, Watermelon & Pineapple มีวัตถุดิบ มะนาว สับปะรด",อยากได้ของหวานที่ทำจากสับปะรดผสมกับผลไม้อื่นๆ
Classic Pound Cake ,เมนูของหวาน เมนู Classic Pound Cake มีวัตถุดิบ วานิลลา,อยากได้เค้กวานิลลาแบบธรรมดา
Classic White Cake Layers ,เมนูของหวาน เมนู Classic White Cake Layers มีวัตถุดิบ วานิลลา,อยากได้เค้กขาววานิลลาเรียบๆ
Strawberry Roulade ,เมนูของหวาน เมนู Strawberry Roulade มีวัตถุดิบ สตรอว์เบอร์รี เลมอน วานิลลา,อยากได้ขนมหวานที่มีสตรอว์เบอร์รีและรสชาติหวานอมเปรี้ยว
Seasonal Fruit Salad with Fresh Mint ,เมนูของหวาน เมนู Seasonal Fruit Salad with Fresh Mint มีวัตถุดิบ สตรอว์เบอร์รี สับปะรด แอปเปิ้ล แบล็กเบอร์รี มินต์,อยากได้สลัดผลไม้ที่สดชื่นและมีรสชาติหลากหลาย
