menu,Description,q
Lemon Cajun Sweet Dough Pies ,เมนูของหวาน เมนู Lemon Cajun Sweet Dough Pies มีวัตถุดิบ วานิลลา เลมอน,อยากกินของหวานที่มีกลิ่นหอมของเลมอน
Dried-Apple Tart with Crisp Crumble Topping ,เมนูของหวาน เมนู Dried-Apple Tart with Crisp Crumble Topping มีวัตถุดิบ แอปเปิล เลมอน อบเชย วานิลลา,อยากกินของหวานที่มีรสชาติหวานเปรี้ยวและมีเนื้อสัมผัสกรุบๆ
Spritz Wreaths ,เมนูของหวาน เมนู Spritz Wreaths มีวัตถุดิบ เชอร์รี,อยากกินของหวานที่มีผลเชอร์รี
Baked Pecan-Stuffed Nectarines ,เมนูของหวาน เมนู Baked Pecan-Stuffed Nectarines มีวัตถุดิบ พีแคน วานิลลา,อยากกินของหวานที่มีเนื้อสัมผัสกรุบๆ และมีผลไม้
"Apple ""Flag"" Tart ","เมนูของหวาน เมนู Apple ""Flag"" Tart มีวัตถุดิบ apple cinnamon cranberry",ฉันอยากกินของหวานที่เป็นผลไม้และมีรสชาติเปรี้ยวหวาน
Chocolate Brownie Cake ,เมนูของหวาน เมนู Chocolate Brownie Cake มีวัตถุดิบ chocolate cocoa vanilla,ฉันอยากทานของหวานที่เป็นช็อกโกแลตและเนื้อนุ่ม
Pecan Praline ,เมนูของหวาน เมนู Pecan Praline มีวัตถุดิบ pecan,ฉันอยากทานของหวานที่มีถั่วพีแคนเป็นส่วนประกอบ
Caramelized Upside-Down Pear Tart ,เมนูของหวาน เมนู Caramelized Upside-Down Pear Tart มีวัตถุดิบ pear cinnamon vanilla,แนะนำของหวานที่มีผลไม้และมีรสชาติหวานหอม
"Espresso ""Pretzels"" ","เมนูของหวาน เมนู Espresso ""Pretzels"" มีวัตถุดิบ cocoa chocolate",ฉันอยากกินของหวานที่มีรสกาแฟผสมผสานกับช็อกโกแลต
Orange Tapioca and Cranberry Parfaits ,เมนูของหวาน เมนู Orange Tapioca and Cranberry Parfaits มีวัตถุดิบ orange vanilla cranberry,ฉันกำลังมองหาของหวานผลไม้ที่สดชื่นและมีรสชาติหวานตัดเปรี้ยว
Sesame Honey Lace Cookies ,เมนูของหวาน เมนู Sesame Honey Lace Cookies มีวัตถุดิบ น้ำผึ้ง,อยากกินของหวานที่มีรสหวานและมีกลิ่นหอมคล้ายน้ำผึ้ง
Pistachio Coins ,เมนูของหวาน เมนู Pistachio Coins มีวัตถุดิบ อัลมอนด์ มะนาว พิสตาชิโอ ช็อกโกแลต แครนเบอร์รี่,อยากกินของหวานที่มีรสหวานเค็มและมีถั่วเป็นส่วนประกอบ
Sparkling Starwiches ,เมนูของหวาน เมนู Sparkling Starwiches มีวัตถุดิบ อัลมอนด์ วานิลลา,อยากกินของหวานที่มีรสหวานและมีกลิ่นหอมคล้ายวานิลลาหรืออัลมอนด์
Minted Berry Spongecakes ,เมนูของหวาน เมนู Minted Berry Spongecakes มีวัตถุดิบ มิ้นต์ มะนาว สตรอว์เบอร์รี่ ราสเบอร์รี่,อยากกินของหวานที่มีรสหวานอมเปรี้ยวเล็กน้อยและมีกลิ่นของมิ้นต์
Spiced Sweet-Potato Cake with Brown Sugar Icing ,เมนูของหวาน เมนู Spiced Sweet-Potato Cake with Brown Sugar Icing มีวัตถุดิบ มันเทศ อบเชย ขิง วานิลลา,อยากกินของหวานที่มีรสหวานและมีกลิ่นของเครื่องเทศแต่ไม่เผ็ดร้อน
Sweet-Potato Flans ,เมนูของหวาน เมนู Sweet-Potato Flans มีวัตถุดิบ มันวานิลลาส้ม,อยากกินอะไรที่มีมันหวานเป็นส่วนประกอบ
Sweetened Strawberries ,เมนูของหวาน เมนู Sweetened Strawberries มีวัตถุดิบ สตรอว์เบอร์รี,อยากกินผลไม้ที่มีรสหวานและสดชื่น
Chocolate-Almond Puddings with Amaretti Crumb Topping ,เมนูของหวาน เมนู Chocolate-Almond Puddings with Amaretti Crumb Topping มีวัตถุดิบ โกโก้วานิลลาอัลมอนด์,มีพุดดิ้งช็อกโกแลตที่ใส่ถั่วอะไรบ้าง
Balsamic-Glazed Strawberries Over Ice Cream ,เมนูของหวาน เมนู Balsamic-Glazed Strawberries Over Ice Cream มีวัตถุดิบ สตรอว์เบอร์รี่วานิลลา,อยากกินสตรอว์เบอร์รีที่มีรสชาติแตกต่างจากที่เคยกิน
Austrian Sweet Cheese Crepes Baked in Custard ,เมนูของหวาน เมนู Austrian Sweet Cheese Crepes Baked in Custard มีวัตถุดิบ ลูกพีช เลมอน วานิลลา คาราเมล,อยากกินของหวานที่มีรสชาติครีมๆ และหวานอ่อนๆ
Chocolate Chip Walnut Pound Cake ,เมนูของหวาน เมนู Chocolate Chip Walnut Pound Cake มีวัตถุดิบ วานิลลา ช็อกโกแลต วอลนัท,อยากกินเค้กที่มีถั่วและช็อกโกแลต
Raspberry Coulis ,เมนูของหวาน เมนู Raspberry Coulis มีวัตถุดิบ ราสป์เบอร์รี,อยากกินของหวานที่มีรสเปรี้ยวๆ ของผลไม้ตระกูลเบอร์รี
Banana Chocolate-Chip Souffles ,เมนูของหวาน เมนู Banana Chocolate-Chip Souffles มีวัตถุดิบ กล้วย ช็อกโกแลต,อยากกินของหวานที่มีกล้วยและช็อกโกแลต
Lemon Crème Caramel ,เมนูของหวาน เมนู Lemon Crème Caramel มีวัตถุดิบ เลมอนวานิลลา,อยากกินของหวานที่มีรสชาติเปรี้ยวอมหวาน
Chocolate Almond Torte ,เมนูของหวาน เมนู Chocolate Almond Torte มีวัตถุดิบ อัลมอนด์ส้มช็อกโกแลตเชอร์รี่เชอร์รี่เชอร์รี่อบเชยส้ม,อยากกินของหวานที่มีรสชาติของผลไม้
Peach and Berry Salad ,เมนูของหวาน เมนู Peach and Berry Salad มีวัตถุดิบ พีชแบล็กเบอร์รี่สตรอว์เบอร์รี่น้ำผึ้งกระวาน,อยากกินของหวานที่มีรสชาติเปรี้ยวอมหวานและมีกลิ่นหอม
Dulce de Platanos ,เมนูของหวาน เมนู Dulce de Platanos มีวัตถุดิบ เหล้ารัมมะพร้าววานิลลา,อยากกินของหวานที่มีรสชาติของเหล้ารัมและมะพร้าว
Chocolate Coconut Squares ,เมนูของหวาน เมนู Chocolate Coconut Squares มีวัตถุดิบ แกรมมะพร้าวช็อกโกแลต,อยากกินของหวานที่มีรสชาติของมะพร้าวและช็อกโกแลต
Apricot Pistachio Fruitcakes ,เมนูของหวาน เมนู Apricot Pistachio Fruitcakes มีวัตถุดิบ พีชลูกเกดลูกแพร์สับปะรดพิสตาชิโอมะพร้าวอัลมอนด์ลูกจันทน์เทศอบเชยส้มเลมอนพีช,อยากกินของหวานที่มีรสชาติของลูกเกดและถั่วพิสตาชิโอ
Chocolate Candy-Cane Rings ,เมนูของหวาน เมนู Chocolate Candy-Cane Rings มีวัตถุดิบ ผงโกโก้ ช็อกโกแลต วนิลลา,อยากกินของหวานที่มีรสชาติหวานและมีผงโกโก้
Strawberry Lemon Bavarian Cake ,เมนูของหวาน เมนู Strawberry Lemon Bavarian Cake มีวัตถุดิบ วนิลลา เลมอน สตรอว์เบอร์รี,อยากกินเค้กผลไม้รสเปรี้ยว หวาน
Prune Souffles ,เมนูของหวาน เมนู Prune Souffles มีวัตถุดิบ เอิร์ล เลมอน ส้ม วนิลลา,อยากกินของหวานที่มีรสเปรี้ยวและกลิ่นหอมแบบผลไม้
Pecan-Butter Truffles ,เมนูของหวาน เมนู Pecan-Butter Truffles มีวัตถุดิบ พีแคน แกรม วนิลลา อบเชย,อยากกินขนมที่รสหวาน เคี้ยวกรุบกรอบ
Sweet Potato Croquettes ,เมนูของหวาน เมนู Sweet Potato Croquettes มีวัตถุดิบ มันเทศ วนิลลา น้ำผึ้ง,อยากกินของหวานที่มีส่วนผสมของผัก
Superb English Plum Pudding ,เมนูของหวาน เมนู Superb English Plum Pudding มีวัตถุดิบ ลูกเกด อบเชย ลูกจันทน์เทศ กานพลู เครื่องเทศรสเผ็ด พริกไทย,อยากกินขนมที่เนื้อแน่น มีเครื่องเทศ กลิ่นเครื่องเทศแรง
Feta with Rosemary Pepper Honey ,เมนูของหวาน เมนู Feta with Rosemary Pepper Honey มีวัตถุดิบ น้ำผึ้ง โรสแมรี่,อยากกินขนมที่หวาน หอมสมุนไพร
Banana Fritters ,เมนูของหวาน เมนู Banana Fritters มีวัตถุดิบ กล้วย รัม,ของหวานที่มีกล้วย หอมๆ และมีกลิ่นแอลกอฮอล์นิดๆ
Lemon-Nutmeg Custards ,เมนูของหวาน เมนู Lemon-Nutmeg Custards มีวัตถุดิบ มะนาว ลูกจันทน์เทศ,อยากกินของหวานที่รสเปรี้ยวๆ มะนาว และหอมเครื่องเทศลูกจันทน์เทศ
Angel Food Cake ,เมนูของหวาน เมนู Angel Food Cake มีวัตถุดิบ วานิลลา,อยากกินของหวานที่มีกลิ่นวานิลลา
Chewy Coconut Macadamia Bars ,เมนูของหวาน เมนู Chewy Coconut Macadamia Bars มีวัตถุดิบ มะพร้าว มะนาว,อยากกินของหวานที่มีมะพร้าว
Orange and Sour-Cream Drop Shortcakes with Assorted Berries ,เมนูของหวาน เมนู Orange and Sour-Cream Drop Shortcakes with Assorted Berries มีวัตถุดิบ แบล็กเบอร์รี่ ราสเบอร์รี่ บลูเบอร์รี่ ส้ม,ของหวานอะไรที่มีผลเบอร์รี่
Aunt Rosé's Pound Cake ,เมนูของหวาน เมนู Aunt Rosé's Pound Cake มีวัตถุดิบ วานิลลา,ฉันอยากกินของหวานที่มีกลิ่นวานิลลาหอมๆ
Lemon Chiffon Cake ,เมนูของหวาน เมนู Lemon Chiffon Cake มีวัตถุดิบ เลมอน,ฉันอยากกินเค้กที่หอมเลมอนมากหน่อย
Apricot Tart with Pistachio-Almond Frangipane ,เมนูของหวาน เมนู Apricot Tart with Pistachio-Almond Frangipane มีวัตถุดิบ พิสตาชิโอ อัลมอนด์ วานิลลา แอปริคอท,ฉันอยากกินขนมที่มีรสหวานอมเปรี้ยวและมีกลิ่นของถั่ว
Hazelnut Torte with Raspberry Jam ,เมนูของหวาน เมนู Hazelnut Torte with Raspberry Jam มีวัตถุดิบ เฮเซลนัท ราสเบอร์รี,ฉันอยากกินเค้กที่มีกลิ่นเฮเซลนัทและมีรสเปรี้ยวจากราสเบอร์รี
Broiled Figs with Oranges and Sherry Cream ,เมนูของหวาน เมนู Broiled Figs with Oranges and Sherry Cream มีวัตถุดิบ ส้ม สะระแหน่ มะเดื่อ,ฉันอยากกินของหวานที่มีกลิ่นหอมของส้มและมีเนื้อที่นุ่ม
Winter Spice Cake with Caramelized Apple Topping ,เมนูของหวาน เมนู Winter Spice Cake with Caramelized Apple Topping มีวัตถุดิบ แอปเปิ้ล อบเชย ขิง Allspice วานิลลา,ฉันอยากกินเค้กที่หอมเครื่องเทศและมีแอปเปิ้ลอยู่ด้านบน
Chocolate-Toffee Easter Eggs ,เมนูของหวาน เมนู Chocolate-Toffee Easter Eggs มีวัตถุดิบ ช็อกโกแลต วานิลลา,ฉันอยากกินขนมหวานที่มีกลิ่นหอมจากช็อกโกแลตและวานิลลา
"Raspberry Cake with Marsala, Crème Fraîche, and Raspberries ","เมนูของหวาน เมนู Raspberry Cake with Marsala, Crème Fraîche, and Raspberries มีวัตถุดิบ ลูกจันทน์เทศ ส้ม วานิลลา เลมอน ราสเบอร์รี",ฉันอยากกินเค้กที่มีกลิ่นละมุนของราสเบอร์รีและส้ม
Spiced-Up Apple Cake ,เมนูของหวาน เมนู Spiced-Up Apple Cake มีวัตถุดิบ อบเชย ขิง แอปเปิลลูกเกด วอลนัท วานิลลา บรั่นดี มะนาว,อยากกินขนมที่ใส่เครื่องเทศและมีแอปเปิล
Chocolate-Cashew Toffee ,เมนูของหวาน เมนู Chocolate-Cashew Toffee มีวัตถุดิบ วานิลลา ช็อกโกแลต แคชชูนัท,อยากกินขนมที่รสหวานเข้มข้นและมีถั่ว
Mixed Nut Tartlets ,เมนูของหวาน เมนู Mixed Nut Tartlets มีวัตถุดิบ น้ำผึ้ง บรั่นดี อัลมอนด์,อยากกินขนมที่รสหวานหอมและมีถั่วหลากหลายชนิด
Roasted Spiced Pears and Figs with Almonds ,เมนูของหวาน เมนู Roasted Spiced Pears and Figs with Almonds มีวัตถุดิบ อัลมอนด์ ลูกแพร์ มะเดื่อ วานิลลา อบเชย ออลสไปซ์,อยากกินขนมที่มีกลิ่นเครื่องเทศและมีผลไม้หลายชนิด
Brownie Sundaes with Banana Chips ,เมนูของหวาน เมนู Brownie Sundaes with Banana Chips มีวัตถุดิบ ช็อกโกแลต วานิลลา กล้วย,อยากกินขนมที่มีช็อกโกแลตและกล้วย
Mixed-Nut Spiced Toffee ,เมนูของหวาน เมนู Mixed-Nut Spiced Toffee มีวัตถุดิบ ออลสไปซ์ พิสตาชิโอ ช็อกโกแลต,อยากกินขนมที่มีเครื่องเทศและถั่ว
Chess Pie ,เมนูของหวาน เมนู Chess Pie มีวัตถุดิบ มะนาว ส้ม,อยากกินขนมที่รสเปรี้ยวและมีมะนาว
Chocolate Orange Fudge ,เมนูของหวาน เมนู Chocolate Orange Fudge มีวัตถุดิบ ช็อกโกแลตส้มส้ม,อยากกินของหวานที่มีรสชาติเปรี้ยวหวานหน่อย
Pralines ,เมนูของหวาน เมนู Pralines มีวัตถุดิบ วานิลลาพีแคน,อยากกินของหวานที่มีรสหวานหอมมีถั่วกรุบกรอบ
Banana Rum Puffs ,เมนูของหวาน เมนู Banana Rum Puffs มีวัตถุดิบ กล้วยเหล้ารัมเลมอน,อยากกินของหวานที่มีรสหวานอ่อนๆและมีกลิ่นหอมอ่อนๆ
Chocolate and Berry Tart ,เมนูของหวาน เมนู Chocolate and Berry Tart มีวัตถุดิบ ช็อกโกแลตราสเบอร์รี่บลูเบอร์รี่,อยากกินของหวานที่มีรสหวานอมเปรี้ยวและมีรสขมบางๆ
Jelly Bowl Cookies ,เมนูของหวาน เมนู Jelly Bowl Cookies มีวัตถุดิบ ราสเบอร์รี่,อยากกินของหวานธรรมชาติๆรสเปรี้ยวนิดๆ
Chocolate Gateaux ,เมนูของหวาน เมนู Chocolate Gateaux มีวัตถุดิบ ช็อกโกแลตช็อกโกแลต,อยากกินของหวานที่มีแค่รสชาติของช็อกโกแลต
Banana Tarts ,เมนูของหวาน เมนู Banana Tarts มีวัตถุดิบ กล้วยอบเชยส้ม,อยากกินขนมที่มีผลไม้สดและครีมซอส
Sweet Potato Rum Pie with Walnut-Gingersnap Crust ,เมนูของหวาน เมนู Sweet Potato Rum Pie with Walnut-Gingersnap Crust มีวัตถุดิบ วอลนัตมันเทศเหล้ารัมฟักทองวอลนัต,อยากกินขนมที่มีมันเทศและเหล้ารัม
Frangipane Tart with Strawberries and Raspberries ,เมนูของหวาน เมนู Frangipane Tart with Strawberries and Raspberries มีวัตถุดิบ อัลมอนด์อัลมอนด์สตรอเบอร์รี่ราสเบอร์รี่ราสเบอร์รี่,อยากกินขนมที่มีราสเบอร์รี่และรสอัลมอนด์
Coconut-Peach Layer Cake ,เมนูของหวาน เมนู Coconut-Peach Layer Cake มีวัตถุดิบ มะพร้าววานิลลามะพร้าวดิบลูกพีชลูกพีชเลมอนมะพร้าววานิลลาดิบลูกพีช,อยากกินขนมที่มีมะพร้าวและลูกพีช
Raisin Pie ,เมนูของหวาน เมนู Raisin Pie มีวัตถุดิบ ส้มเลมอนเลมอน,อยากกินขนมที่มีรสส้มและรสเปรี้ยว
Raspberry Tart May ,เมนูของหวาน เมนู Raspberry Tart May มีวัตถุดิบ วานิลลา ราสเบอร์รี่,อยากกินของหวานที่มีผลไม้รสเปรี้ยวหวาน
Chocolate Pecan Pie ,เมนูของหวาน เมนู Chocolate Pecan Pie มีวัตถุดิบ พีแคน วานิลลา ช็อกโกแลต,อยากกินพายรสช็อกโกแลต
Red and Green Grape Gratin ,เมนูของหวาน เมนู Red and Green Grape Gratin มีวัตถุดิบ มะนาว วานิลลา องุ่น อัลมอนด์,อยากกินของหวานที่มีองุ่นและรสเปรี้ยวๆ หวานๆ
Oatmeal Date Cookies ,เมนูของหวาน เมนู Oatmeal Date Cookies มีวัตถุดิบ อินทผาลัม วานิลลา ข้าวโอ๊ต,อยากกินคุกกี้ที่มีถั่วและผลไม้อบแห้ง
Gingered Peach and Brown Sugar Sundaes ,เมนูของหวาน เมนู Gingered Peach and Brown Sugar Sundaes มีวัตถุดิบ ขิง วานิลลา พีช อัลมอนด์,อยากกินไอศกรีมที่มีผลไม้รสเปรี้ยวและหวาน
Nita's Crazy Cake ,เมนูของหวาน เมนู Nita's Crazy Cake มีวัตถุดิบ โกโก้ วานิลลา,อยากกินเค้กที่มีรสโกโก้เข้มข้น
Star Anise Lace Cookies ,เมนูของหวาน เมนู Star Anise Lace Cookies มีวัตถุดิบ ยี่หร่า,อยากกินคุกกี้ที่กรอบและมีรสหวานจากเครื่องเทศ
Cane Syrup Pecan Ice Cream ,เมนูของหวาน เมนู Cane Syrup Pecan Ice Cream มีวัตถุดิบ วานิลลา พีแคน,อยากกินของหวานเย็นๆ ที่มีรสชาติหวานนัวจากวัตถุดิบธรรมชาติ
Lemon Poppyseed Cake with Fruit Compote ,เมนูของหวาน เมนู Lemon Poppyseed Cake with Fruit Compote มีวัตถุดิบ เลมอน วานิลลา ไทม์ พลัม,อยากกินของหวานที่ให้ความสดชื่นและมีส่วนผสมของผลไม้
Lemon-Lime Ring with Mixed Berries and Mango ,เมนูของหวาน เมนู Lemon-Lime Ring with Mixed Berries and Mango มีวัตถุดิบ เลมอน ไลม์ สตรอว์เบอร์รี มะม่วง ราสเบอร์รี แบล็กเบอร์รี บลูเบอร์รี มิ้นต์,อยากกินของหวานเปรี้ยวหวานที่รสชาติไม่ซ้ำซาก
Christmas Fruit Pies Massam ,เมนูของหวาน เมนู Christmas Fruit Pies Massam มีวัตถุดิบ แอปเปิล ลูกเกด เลมอน วิสกี้,อยากกินพายผลไม้ที่รสชาติเป็นเอกลักษณ์และมีกลิ่นหอมของเครื่องเทศ
