menu,Description,q
"Meringue, Chocolate, and Kirsch Cream Layer Cake ","เมนูของหวาน เมนู Meringue, Chocolate, and Kirsch Cream Layer Cake มีวัตถุดิบ เฮเซลนัท ช็อกโกแลต",มีอะไรแนะนำไหมสำหรับเค้กที่ใช้ชั้นครีมและช็อกโกแลตเป็นส่วนผสม?
Blueberry Crisp with Cinnamon-Streusel Topping ,เมนูของหวาน เมนู Blueberry Crisp with Cinnamon-Streusel Topping มีวัตถุดิบ บลูเบอร์รี่ย์ วอลนัท อบเชย,อยากได้ของหวานที่สมดุลทั้งความเปรี้ยวและหวานจากผลไม้เบอร์รี่และเครื่องเทศ
Grapefruit Tart ,เมนูของหวาน เมนู Grapefruit Tart มีวัตถุดิบ มัสกัปโปน ขิง,เมนูของหวาน อยากกินอะไรที่มีผลไม้รสเปรี้ยวและชีส
Raspberry and Peach Parfait Cake ,เมนูของหวาน เมนู Raspberry and Peach Parfait Cake มีวัตถุดิบ มะพร้าว อัลมอนด์ เลมอน ลูกพีช ราสเบอร์รี่ ช็อกโกแลต,เมนูของหวาน อยากกินอะไรที่มีผลไม้หลายชนิดและรสเปรี้ยวอมหวาน
Berry Puffs with Orange Muscat Cream ,เมนูของหวาน เมนู Berry Puffs with Orange Muscat Cream มีวัตถุดิบ เลมอน ราสเบอร์รี่ แบล็กเบอร์รี่ ส้ม,เมนูของหวาน อยากกินอะไรที่มีผลเบอร์รี่และรสชาติสดชื่น
New Orleans Banana Split ,เมนูของหวาน เมนู New Orleans Banana Split มีวัตถุดิบ กล้วยเหล้า กล้วย วานิลลา ช็อกโกแลต พีแคน มะพร้าว,เมนูของหวาน อยากกินอะไรที่มีกล้วย น้ำตาลทราย และผลไม้หลายชนิด
Cranberry-Citrus Sorbet ,เมนูของหวาน เมนู Cranberry-Citrus Sorbet มีวัตถุดิบ แครนเบอร์รี่ ส้ม เลมอน,เมนูของหวาน อยากกินอะไรที่มีรสเปรี้ยว สดชื่น และมีผลไม้หลายชนิด
Gianduia Mousse Cake ,เมนูของหวาน เมนู Gianduia Mousse Cake มีวัตถุดิบ ช็อกโกแลต เฮเซลนัท,เมนูของหวาน อยากกินอะไรที่มีช็อกโกแลตและถั่วเฮเซลนัท
Buttermilk Cake with Blackberries and Beaumes-de-Venise ,เมนูของหวาน เมนู Buttermilk Cake with Blackberries and Beaumes-de-Venise มีวัตถุดิบ วานิลลา ส้ม แบล็กเบอร์รี่,เมนูของหวาน อยากกินอะไรที่มีผลไม้รสเปรี้ยวและรสชาติหวานแบบคลาสสิก
Cherries in Spiced Wine Syrup ,เมนูของหวาน เมนู Cherries in Spiced Wine Syrup มีวัตถุดิบ เบย์ กานพลู เลมอน บรั่นดี เชอร์รี อบเชย วานิลลา,อยากกินของหวานที่มีรสเปรี้ยวหวานจากผลไม้และมีกลิ่นเครื่องเทศอ่อนๆ
Stained-Glass Teardrops ,เมนูของหวาน เมนู Stained-Glass Teardrops มีวัตถุดิบ วานิลลา,อยากกินขนมหวานที่รสชาติไม่หวานมาก
Frozen Amaretto Cream Baskets with Berries ,เมนูของหวาน เมนู Frozen Amaretto Cream Baskets with Berries มีวัตถุดิบ สตรอว์เบอร์รี บลูเบอร์รี ราสเบอร์รี,อยากกินของหวานที่มีความเย็นชื่นใจแบบครีมๆ และมีรสเปรี้ยวหวานจากผลไม้
Rustic Nectarine and Blackberry Crostata with Cornmeal Crust ,เมนูของหวาน เมนู Rustic Nectarine and Blackberry Crostata with Cornmeal Crust มีวัตถุดิบ ส้ม แบล็กเบอร์รี วานิลลา พีช,อยากกินของหวานที่มีรสหวานอมเปรี้ยวจากผลไม้และมีกลิ่นหอมอ่อนๆ
Watermelon Sorbet ,เมนูของหวาน เมนู Watermelon Sorbet มีวัตถุดิบ เลมอน,อยากกินของหวานเย็นๆ ที่มีรสหวานอมเปรี้ยวสดชื่น
Vanilla Bean Ice Cream ,เมนูของหวาน เมนู Vanilla Bean Ice Cream มีวัตถุดิบ วานิลลาวานิลลา,อยากกินของหวานที่มีกลิ่นวานิลลา
Pear Pie with Maple and Ginger ,เมนูของหวาน เมนู Pear Pie with Maple and Ginger มีวัตถุดิบ ลูกแพร์เมเปิลเลมอนขิงวานิลลามะนาว,อยากกินพายลูกแพร์ที่มีกลิ่นขิงและเมเปิ้ล
Peaches in Caramel Over Vanilla Ice Cream ,เมนูของหวาน เมนู Peaches in Caramel Over Vanilla Ice Cream มีวัตถุดิบ พีชเลมอนวานิลลา,อยากกินของหวานที่มีพีชและราดคาราเมล
Fried Sweet Cheese Ravioli with Honey ,เมนูของหวาน เมนู Fried Sweet Cheese Ravioli with Honey มีวัตถุดิบ ริคอตต้าเลมอนเกาลัด,อยากกินของหวานราดน้ำผึ้งที่มีชีสและเกาลัด
Cantaloupe in Port Jelly ,เมนูของหวาน เมนู Cantaloupe in Port Jelly มีวัตถุดิบ เลมอน,เมนูของหวานที่ให้ความรู้สึกสดชื่นด้วยรสชาติของเลมอน
Chocolate and Coconut Cream Fondue ,เมนูของหวาน เมนู Chocolate and Coconut Cream Fondue มีวัตถุดิบ มะพร้าว ช็อกโกแลต สับปะรด,เมนูของหวานที่ผสมผสานความหวานของมะพร้าวและความเข้มข้นของช็อกโกแลต
Chocolate-Caramel Tartlets with Roasted Bananas and Ginger-Citrus Caramel ,เมนูของหวาน เมนู Chocolate-Caramel Tartlets with Roasted Bananas and Ginger-Citrus Caramel มีวัตถุดิบ โกโก้ เลมอน ช็อกโกแลต ลูกเกดสีทอง ส้ม กระเทียม วานิลลา กล้วย,เมนูของหวานที่ผสมผสานรสชาติของช็อกโกแลต คาราเมล กล้วย และขิง
Peanut Butter Cookie Mousse Cake ,เมนูของหวาน เมนู Peanut Butter Cookie Mousse Cake มีวัตถุดิบ ถั่วลิสง ช็อกโกแลต,เมนูของหวานที่มีเนื้อสัมผัสเนียนนุ่มพร้อมกลิ่นหอมของถั่วลิสง
Asian Pears with Vanilla-Poached Kumquats ,เมนูของหวาน เมนู Asian Pears with Vanilla-Poached Kumquats มีวัตถุดิบ วานิลลา มะนาว ลูกแพร์,เมนูของหวานที่นำเสนอผลไม้สดอย่างลูกแพร์ พร้อมรสชาติหวานอมเปรี้ยว
Devil's Food Cupcakes ,เมนูของหวาน เมนู Devil's Food Cupcakes มีวัตถุดิบ ช็อกโกแลต กาแฟ,เมนูของหวานที่มีกลิ่นหอมของช็อกโกแลตและกาแฟ
Chocolate-Walnut Pie ,เมนูของหวาน เมนู Chocolate-Walnut Pie มีวัตถุดิบ ช็อกโกแลต วานิลลา วอลนัท,อยากกินของหวานที่กรอบๆ ด้านนอก แต่นุ่มๆ ด้านใน
Honeydew and Cantaloupe with Cinnamon-Clove Syrup ,เมนูของหวาน เมนู Honeydew and Cantaloupe with Cinnamon-Clove Syrup มีวัตถุดิบ ขิง กานพลู อบเชย รัม,อยากกินของหวานรสหวานเย็นๆ มีอะไรแนะนำไหม
"Coffee Toffee ""Pie"" ","เมนูของหวาน เมนู Coffee Toffee ""Pie"" มีวัตถุดิบ ช็อกโกแลต รัม",อยากกินของหวานที่รสชาติหวานเข้มข้น มีรสขมนิดๆ
Prune Tequila Ice Cream ,เมนูของหวาน เมนู Prune Tequila Ice Cream มีวัตถุดิบ พลัม เทกีลา วานิลลา,อยากกินของหวานที่รสชาติหวานและมีอะไรบางอย่างที่เผ็ดนิดๆ
Vanilla-Orange Custard with Caramel ,เมนูของหวาน เมนู Vanilla-Orange Custard with Caramel มีวัตถุดิบ ส้ม วานิลลา มะนาว,อยากกินของหวานที่มีรสชาติเปรี้ยวหวานพร้อมกลิ่นหอมของผลไม้
Chocolate-Orange Decadence ,เมนูของหวาน เมนู Chocolate-Orange Decadence มีวัตถุดิบ ส้ม วานิลลา ช็อกโกแลตส้ม ราสเบอร์รี่ มิ้นท์,อยากกินของหวานที่มีรสชาติหวานๆ แต่ไม่หวานจนเกินไปโดยมีรสเปรี้ยวตัด
Chocolate Chili Ice Cream ,เมนูของหวาน เมนู Chocolate Chili Ice Cream มีวัตถุดิบ ช็อกโกแลต อบเชย อัลมอนด์,อยากกินของหวานที่รสชาติหวานแต่แฝงด้วยรสขมและมีอะไรบางอย่างที่กรุบๆ
Rustic Plum Pie ,เมนูของหวาน เมนู Rustic Plum Pie มีวัตถุดิบ พลัม มะนาว,อยากกินของหวานที่รสชาติเปรี้ยวนำ หวานตาม
Kugelhopf ,เมนูของหวาน เมนู Kugelhopf มีวัตถุดิบ ลูกเกด มะนาว อัลมอนด์,อยากกินของหวานที่มีรสชาติเปรี้ยวนำ หวานตาม และมีอะไรให้เคี้ยว
Apricot Cream-Cheese Ice Cream ,เมนูของหวาน เมนู Apricot Cream-Cheese Ice Cream มีวัตถุดิบ แอปริคอต มะนาว,อยากกินของหวานที่รสชาติหวาน และเปรี้ยวมีกลิ่นหอมสดชื่น
Rum Currant Ice Cream ,เมนูของหวาน เมนู Rum Currant Ice Cream มีวัตถุดิบ รัม,เมนูของหวาน อยากกินไอศกรีมที่มีรสชาติแบบเครื่องดื่มแอลกอฮอล์
Chocolate Cherry Charlottes ,เมนูของหวาน เมนู Chocolate Cherry Charlottes มีวัตถุดิบ เชอร์รี อัลมอนด์ ช็อกโกแลต,เมนูของหวาน อยากกินของหวานที่มีรสชาติตัดกันของเปรี้ยวกับหวานนิดๆ
Milk Chocolate-Espresso Truffles ,เมนูของหวาน เมนู Milk Chocolate-Espresso Truffles มีวัตถุดิบ ช็อกโกแลต กาแฟ โกโก้,เมนูของหวาน อยากกินขนมหวานที่มีเอกลักษณ์รสชาติด้วยกาแฟสักอย่าง
Port-Glazed Grape Tarts With Pecan Crust ,เมนูของหวาน เมนู Port-Glazed Grape Tarts With Pecan Crust มีวัตถุดิบ พีแคน อบเชย ขิง องุ่น เลมอน,เมนูของหวาน อยากกินขนมหวานที่มีเอกลักษณ์รสชาติด้วยผลไม้ตากสักอย่าง
Pine Nut Honey Ice Cream ,เมนูของหวาน เมนู Pine Nut Honey Ice Cream มีวัตถุดิบ น้ำผึ้ง วานิลลา,เมนูของหวาน อยากกินไอศกรีมที่มีเอกลักษณ์รสชาติด้วยรสหวานธรรมชาติสักอย่าง
Pbj Crumble Bar,เมนูของหวาน เมนู Pbj Crumble Bar มีวัตถุดิบ ถั่วลิสง องุ่น,เมนูของหวาน อยากกินขนมหวานที่เนื้อนุ่มๆ กัดแล้วเจออะไรบางอย่างกรุบๆ
Irish Currant and Raisin Cake ,เมนูของหวาน เมนู Irish Currant and Raisin Cake มีวัตถุดิบ ลูกเกด,อยากกินของหวานที่มีลูกเกด
Coffee-Molasses Shoofly Pie ,เมนูของหวาน เมนู Coffee-Molasses Shoofly Pie มีวัตถุดิบ วานิลลาอบเชยวานิลลา,อยากกินของหวานที่มีกลิ่นหอม
Chocolate-Chocolate Chip Cream Frosting ,เมนูของหวาน เมนู Chocolate-Chocolate Chip Cream Frosting มีวัตถุดิบ โกโก้ช็อคโกแลต,อยากกินของหวานที่เข้มข้นและมีช็อกโกแลตเยอะๆ
Flan ,เมนูของหวาน เมนู Flan มีวัตถุดิบ วานิลลา,อยากกินของหวานที่มีรสชาติหวานและกลิ่นหอม
Creamy Lime Pie ,เมนูของหวาน เมนู Creamy Lime Pie มีวัตถุดิบ มะนาวมะนาวส้มส้มลูกแพร์,อยากกินของหวานที่มีรสเปรี้ยวและหอมมะนาว
Ginger Molasses Lace Cookies ,เมนูของหวาน เมนู Ginger Molasses Lace Cookies มีวัตถุดิบ เลมอนขิง,ฉันกำลังมองหาขนมอบที่มีรสชาติของผลไม้รสเปรี้ยวและเครื่องเทศอบอุ่น
Strawberry-Sambuca Sorbet ,เมนูของหวาน เมนู Strawberry-Sambuca Sorbet มีวัตถุดิบ สตรอว์เบอร์รีเลมอน,ฉันต้องการของหวานแสนสดชื่นที่มีรสชาติหวานอมเปรี้ยวของผลไม้ฤดูร้อน
White Chocolate and Lemon Wedding Cake ,เมนูของหวาน เมนู White Chocolate and Lemon Wedding Cake มีวัตถุดิบ เลมอนช็อกโกแลตเลมอนช็อกโกแลตส้มวานิลลากุหลาบสตรอว์เบอร์รี่แบล็กเบอร์รี่ราสเบอร์รี่บลูเบอร์รี่,ฉันมองหาเค้กแต่งงานที่มีรสชาติที่ซับซ้อนของส้ม ช็อกโกแลต และผลเบอร์รี่
Neapolitan Ricotta and Wheatberry Pie ,เมนูของหวาน เมนู Neapolitan Ricotta and Wheatberry Pie มีวัตถุดิบ วานิลลาริคอตตาส้มอบเชย,ฉันอยากทานพายที่มีรสชาติของวานิลลาอบเชยและผลไม้รสเปรี้ยว
Raspberry Ice Cream ,เมนูของหวาน เมนู Raspberry Ice Cream มีวัตถุดิบ ราสเบอร์รี่ เลมอน วานิลลา,อยากทานไอศกรีมผลไม้ที่มีรสชาติหวานอมเปรี้ยว
Lime Mousse with Lime-Vanilla Syrup ,เมนูของหวาน เมนู Lime Mousse with Lime-Vanilla Syrup มีวัตถุดิบ วานิลลา มะนาว,อยากกินมูสที่มีรสเปรี้ยวๆ หน่อย
Vinegar Pie ,เมนูของหวาน เมนู Vinegar Pie มีวัตถุดิบ อบเชย,อยากกินของหวานรสชาติเปรี้ยวหวานที่มีกลิ่นหอมของเครื่องเทศ
Dried-Fruit Compote with Vanilla and Orange ,เมนูของหวาน เมนู Dried-Fruit Compote with Vanilla and Orange มีวัตถุดิบ ส้ม วานิลลา มะเดื่อ แอปริคอต,อยากกินของหวานรสชาติหวานที่มีส่วนผสมของผลไม้อบแห้ง
Chocolate Megeve Cake ,เมนูของหวาน เมนู Chocolate Megeve Cake มีวัตถุดิบ โกโก้,อยากกินของหวานรสชาติหวานเข้มที่มีส่วนผสมของช็อกโกแลต
Rhubarb Daisy Cake ,เมนูของหวาน เมนู Rhubarb Daisy Cake มีวัตถุดิบ วานิลลา ขิง เลมอน รูบาร์บ,อยากกินของหวานรสชาติหวานเปรี้ยวที่มีส่วนผสมของผลไม้รสเปรี้ยว
Sauternes-Soaked Genoise with Candied Kumquats ,เมนูของหวาน เมนู Sauternes-Soaked Genoise with Candied Kumquats มีวัตถุดิบ วานิลลา อัลมอนด์,อยากกินของหวานรสชาติหวานที่มีกลิ่นหอมของแอลกอฮอล์และผลไม้รสเปรี้ยว
Anise Pine-Nut Cookies ,เมนูของหวาน เมนู Anise Pine-Nut Cookies มีวัตถุดิบ วานิลลา,อยากกินของหวานรสชาติหวานมันที่มีกลิ่นหอมของเครื่องเทศ
Raisin Tea Cake ,เมนูของหวาน เมนู Raisin Tea Cake มีวัตถุดิบ อบเชย กานพลู ออลสไปซ์ ลูกจันทน์เทศ ขิง ลูกเกด,อาหารหวานที่หอมอบเชยและลูกเกดเป็นส่วนประกอบหลักคืออะไร
Peach Tart ,เมนูของหวาน เมนู Peach Tart มีวัตถุดิบ อัลมอนด์ พีช น้ำผึ้ง ราสเบอร์รี่,อาหารหวานที่มีพีชและราสเบอร์รี่ผสมผสานกันคืออะไร
Fresh Citrus Compote ,เมนูของหวาน เมนู Fresh Citrus Compote มีวัตถุดิบ ส้ม อนิส วานิลลา สับปะรด,อาหารหวานทีมีกลิ่นรสของส้มและวานิลลาเป็นหลักคืออะไร
Bittersweet Chocolate Fallen Soufflé Cakes ,เมนูของหวาน เมนู Bittersweet Chocolate Fallen Soufflé Cakes มีวัตถุดิบ ช็อกโกแลต เหล้ารัม,อาหารหวานที่มีรสชาติของช็อกโกแลตและมีส่วนผสมของเหล้าคืออะไร
Pistachio Rosewater Turkish Delight ,เมนูของหวาน เมนู Pistachio Rosewater Turkish Delight มีวัตถุดิบ พิสตาชิโอ,อาหารหวานที่มีกลิ่นกุหลาบและพิสตาชิโอเป็นส่วนประกอบสำคัญคืออะไร
Strawberry Cream Cake ,เมนูของหวาน เมนู Strawberry Cream Cake มีวัตถุดิบ สตรอว์เบอร์รี มะนาว วนิลลา,อยากกินเค้กที่มีผลไม้รสชาติเปรี้ยว
Blueberries with Yogurt and Maple-Blueberry Syrup ,เมนูของหวาน เมนู Blueberries with Yogurt and Maple-Blueberry Syrup มีวัตถุดิบ เมเปิ้ล บลูเบอร์รี มะนาว,อยากกินของหวานรสเปรี้ยวที่ไม่ใช่เค้ก
White Chocolate Leather ,เมนูของหวาน เมนู White Chocolate Leather มีวัตถุดิบ ช็อกโกแลต,อยากกินช็อกโกแลตที่ไม่ใช่ในรูปแบบเค้ก
Warm Walnut Brownie Pudding ,เมนูของหวาน เมนู Warm Walnut Brownie Pudding มีวัตถุดิบ โกโก้ วนิลลา วอลนัท,อยากกินขนมปังเนื้อนุ่มที่รสชาติเข้มข้น
S'more Sundaes ,เมนูของหวาน เมนู S'more Sundaes มีวัตถุดิบ มาร์ชเมลโลว์ วนิลลา ช็อกโกแลต เกรแฮม,อยากกินของหวานที่มีมาร์ชเมลโลว์และช็อกโกแลต
Old-Fashioned Apple Cake ,เมนูของหวาน เมนู Old-Fashioned Apple Cake มีวัตถุดิบ มะนาวดอง,เมนูของหวานแบบอบรสเปรี้ยวอมหวานที่มีส่วนผสมของผลไม้
Honey Phyllo Ice Cream Cups ,เมนูของหวาน เมนู Honey Phyllo Ice Cream Cups มีวัตถุดิบ น้ำผึ้ง มะนาวลูกพีชลูกพีช,เมนูของหวานแบบเย็นที่มีน้ำผึ้งเป็นส่วนผสมหลักและมีรสชาติผลไม้สดชื่น
Wellesley Fudge Cupcakes ,เมนูของหวาน เมนู Wellesley Fudge Cupcakes มีวัตถุดิบ ช็อกโกแลต วานิลลา,เมนูของหวานช็อกโกแลตเนื้อนุ่ม
Pumpkin Roll Cake with Cream Cheese Filling ,เมนูของหวาน เมนู Pumpkin Roll Cake with Cream Cheese Filling มีวัตถุดิบ อบเชย ฟักทอง วานิลลา วอลนัท,เมนูของหวานแบบอบสอดไส้รสหวานที่มีส่วนผสมของเครื่องเทศฤดูใบไม้ร่วง
Sticky Rice with Mango ,เมนูของหวาน เมนู Sticky Rice with Mango มีวัตถุดิบ มะพร้าว มะม่วง,เมนูของหวานแบบร้อนที่ทำจากข้าวพร้อมซอสผลไม้
